{
  "migration_id": "0818-1400",
  "last_updated": "2026-08-18T14:22:00Z",
  "current_phase": "complete",
  "run_mode": "decide",
  "phases": {
    "discover": "completed",
    "clarify": "completed",
    "design": "completed",
    "estimate": "completed",
    "workshop": "completed",
    "generate": "pending",
    "feedback": "completed"
  }
}
