{
  "migration_id": "0818-1400",
  "run_id": "7a2b1c9d-4e8f-4c3a-b6d1-2f9e8c7b6a54",
  "owning_skill": "HEROKU_TO_AWS",
  "last_updated": "2026-08-18T14:22:00Z",
  "current_phase": "complete",
  "run_mode": "decide",
  "phases": {
    "discover": "completed",
    "clarify": "completed",
    "design": "completed",
    "estimate": "completed",
    "workshop": "completed",
    "generate": "pending",
    "feedback": "completed"
  }
}
